{
  "id": "status_update",
  "version": 1,
  "entry": "seq",
  "nodes": [
    {
      "id": "seq",
      "type": "Sequence",
      "children": ["build_messages", "call_analyzer", "extract"]
    },
    {
      "id": "build_messages",
      "type": "Code",
      "params": {
        "function": "build_analyzer_messages",
        "outputs": ["messages"]
      }
    },
    {
      "id": "call_analyzer",
      "type": "LLMChat",
      "params": {
        "model": "analyzer-llm",
        "messages_from": "messages",
        "response_field": "analysis_text"
      }
    },
    {
      "id": "extract",
      "type": "Map",
      "params": {
        "set": {
          "protagonist_mood": "analysis_text"
        }
      }
    }
  ]
}